{
  "version": "1.0",
  "workspace": {"name": "Comercio Andino - flujo de valor y servicios", "description": "Capacidades de negocio, aplicaciones y tecnología de un comercio con tienda online y almacenes propios"},
  "units": [
    {"id": "direccion-comercial", "name": "Dirección Comercial"},
    {"id": "ventas", "name": "Ventas", "parentId": "direccion-comercial"},
    {"id": "atencion", "name": "Atención al cliente", "parentId": "direccion-comercial"},
    {"id": "operaciones", "name": "Operaciones"},
    {"id": "logistica", "name": "Logística", "parentId": "operaciones"},
    {"id": "finanzas", "name": "Finanzas"},
    {"id": "ti", "name": "Tecnología (TI)"},
    {"id": "plataforma", "name": "Equipo Plataforma", "parentId": "ti"}
  ],
  "capabilities": [
    {"id": "gestion-comercial", "name": "Gestión comercial", "ownerId": "direccion-comercial", "importance": "core"},
    {"id": "ventas-online", "name": "Ventas online", "parentId": "gestion-comercial", "importance": "differentiating", "maturity": 4},
    {"id": "gestion-pedidos", "name": "Gestión de pedidos", "parentId": "gestion-comercial", "ownerId": "ventas", "importance": "core", "maturity": 4},
    {"id": "gestion-clientes", "name": "Gestión de clientes", "parentId": "gestion-comercial", "importance": "core", "maturity": 3},
    {"id": "precios-promociones", "name": "Precios y promociones", "parentId": "gestion-comercial", "importance": "differentiating", "maturity": 3},
    {"id": "cadena-suministro", "name": "Cadena de suministro", "ownerId": "operaciones", "importance": "core"},
    {"id": "gestion-inventario", "name": "Gestión de inventario", "parentId": "cadena-suministro", "ownerId": "logistica", "importance": "core", "maturity": 3},
    {"id": "distribucion", "name": "Distribución y entrega", "parentId": "cadena-suministro", "ownerId": "logistica", "importance": "core", "maturity": 2},
    {"id": "compras", "name": "Compras y proveedores", "parentId": "cadena-suministro", "importance": "supporting", "maturity": 3},
    {"id": "gestion-financiera", "name": "Gestión financiera", "ownerId": "finanzas", "importance": "core"},
    {"id": "facturacion", "name": "Facturación", "parentId": "gestion-financiera", "importance": "core", "maturity": 4},
    {"id": "cobros", "name": "Cobros y pagos", "parentId": "gestion-financiera", "importance": "core", "maturity": 3},
    {"id": "contabilidad", "name": "Contabilidad", "parentId": "gestion-financiera", "importance": "supporting", "maturity": 4},
    {"id": "experiencia-cliente", "name": "Experiencia del cliente", "ownerId": "atencion", "importance": "differentiating"},
    {"id": "atencion-cliente", "name": "Atención al cliente", "parentId": "experiencia-cliente", "importance": "differentiating", "maturity": 3},
    {"id": "fidelizacion", "name": "Fidelización", "parentId": "experiencia-cliente", "importance": "differentiating", "maturity": 3}
  ],
  "processes": [
    {"id": "alta-pedido", "name": "Alta de pedido", "ownerId": "ventas"},
    {"id": "devoluciones", "name": "Gestión de devoluciones", "ownerId": "atencion"},
    {"id": "cierre-mensual", "name": "Cierre contable mensual", "ownerId": "finanzas"}
  ],
  "applications": [
    {"id": "tienda-web", "name": "Tienda online", "technology": "React + Node.js", "ownerId": "ventas", "criticality": "critical", "annualCost": 180000, "users": 25000, "strategy": "keep", "ref": "urn:iark:integration:tienda-web", "refType": "realizes"},
    {"id": "erp", "name": "ERP corporativo", "technology": "SAP S/4HANA", "vendor": "SAP", "ownerId": "finanzas", "criticality": "critical", "annualCost": 1200000, "users": 450, "strategy": "keep"},
    {"id": "crm", "name": "CRM", "technology": "Salesforce", "vendor": "Salesforce", "ownerId": "ventas", "criticality": "high", "annualCost": 240000, "users": 120, "strategy": "keep", "external": true},
    {"id": "motor-precios", "name": "Motor de precios", "technology": "Java + Redis", "ownerId": "ventas", "criticality": "medium"},
    {"id": "wms-legacy", "name": "WMS heredado", "technology": "Oracle Forms", "ownerId": "logistica", "lifecycle": "sunset", "criticality": "high", "annualCost": 90000, "users": 60, "strategy": "replace"},
    {"id": "wms-nuevo", "name": "WMS nuevo", "technology": "Java + PostgreSQL", "ownerId": "logistica", "lifecycle": "planned", "criticality": "high", "annualCost": 150000, "users": 60, "strategy": "keep"},
    {"id": "tms", "name": "Gestión de transporte", "technology": "Transporeon", "vendor": "Transporeon", "ownerId": "logistica", "criticality": "medium", "annualCost": 48000, "users": 35, "strategy": "keep", "external": true},
    {"id": "portal-proveedores", "name": "Portal de proveedores", "technology": "Node.js", "ownerId": "logistica", "criticality": "medium", "annualCost": 30000, "users": 300, "strategy": "migrate"},
    {"id": "facturacion-electronica", "name": "Facturación electrónica", "technology": "Java", "ownerId": "finanzas", "criticality": "high", "ref": "urn:iark:integration:facturacion", "refType": "realizes"},
    {"id": "pasarela-pagos", "name": "Pasarela de pagos", "technology": "Stripe", "vendor": "Stripe", "ownerId": "finanzas", "criticality": "high", "external": true, "ref": "urn:iark:integration:pasarela-pagos", "refType": "realizes"},
    {"id": "contact-center", "name": "Contact center", "technology": "Genesys Cloud", "vendor": "Genesys", "ownerId": "atencion", "criticality": "medium", "external": true}
  ],
  "technologies": [
    {"id": "kubernetes", "name": "Kubernetes", "kind": "platform", "version": "1.29", "ownerId": "plataforma"},
    {"id": "aws", "name": "AWS", "kind": "infrastructure", "ownerId": "plataforma"},
    {"id": "hana", "name": "SAP HANA", "kind": "database", "version": "2.0", "ownerId": "ti", "endOfLife": "2034-12"},
    {"id": "postgres", "name": "PostgreSQL", "kind": "database", "version": "16", "ownerId": "plataforma"},
    {"id": "oracle-11g", "name": "Oracle Database", "kind": "database", "version": "11g", "ownerId": "ti", "lifecycle": "sunset"}
  ],
  "valueStreams": [
    {"id": "pedido-a-entrega", "name": "Del pedido a la entrega", "stakeholder": "Cliente de la tienda", "ownerId": "operaciones"}
  ],
  "valueStages": [
    {"id": "descubrir", "name": "Descubrir y elegir", "streamId": "pedido-a-entrega", "value": "producto elegido"},
    {"id": "pedir", "name": "Pedir y pagar", "streamId": "pedido-a-entrega", "value": "pedido confirmado"},
    {"id": "preparar", "name": "Preparar el pedido", "streamId": "pedido-a-entrega", "value": "pedido listo"},
    {"id": "entregar", "name": "Entregar", "streamId": "pedido-a-entrega", "value": "producto en casa"},
    {"id": "posventa", "name": "Atender posventa", "streamId": "pedido-a-entrega", "value": "cliente satisfecho"}
  ],
  "businessServices": [
    {"id": "compra-online", "name": "Compra online", "audience": "Clientes particulares", "ownerId": "ventas"},
    {"id": "envio-a-domicilio", "name": "Envío a domicilio", "audience": "Clientes particulares", "ownerId": "logistica"}
  ],
  "relations": [
    {"id": "tienda-web--supports--ventas-online", "kind": "supports", "sourceId": "tienda-web", "targetId": "ventas-online"},
    {"id": "tienda-web--supports--alta-pedido", "kind": "supports", "sourceId": "tienda-web", "targetId": "alta-pedido"},
    {"id": "erp--supports--alta-pedido", "kind": "supports", "sourceId": "erp", "targetId": "alta-pedido"},
    {"id": "erp--supports--gestion-pedidos", "kind": "supports", "sourceId": "erp", "targetId": "gestion-pedidos"},
    {"id": "crm--supports--gestion-clientes", "kind": "supports", "sourceId": "crm", "targetId": "gestion-clientes"},
    {"id": "crm--supports--fidelizacion", "kind": "supports", "sourceId": "crm", "targetId": "fidelizacion"},
    {"id": "motor-precios--supports--precios-promociones", "kind": "supports", "sourceId": "motor-precios", "targetId": "precios-promociones"},
    {"id": "wms-legacy--supports--gestion-inventario", "kind": "supports", "sourceId": "wms-legacy", "targetId": "gestion-inventario"},
    {"id": "wms-nuevo--supports--gestion-inventario", "kind": "supports", "sourceId": "wms-nuevo", "targetId": "gestion-inventario"},
    {"id": "tms--supports--distribucion", "kind": "supports", "sourceId": "tms", "targetId": "distribucion"},
    {"id": "portal-proveedores--supports--compras", "kind": "supports", "sourceId": "portal-proveedores", "targetId": "compras"},
    {"id": "facturacion-electronica--supports--facturacion", "kind": "supports", "sourceId": "facturacion-electronica", "targetId": "facturacion"},
    {"id": "erp--supports--facturacion", "kind": "supports", "sourceId": "erp", "targetId": "facturacion"},
    {"id": "pasarela-pagos--supports--cobros", "kind": "supports", "sourceId": "pasarela-pagos", "targetId": "cobros"},
    {"id": "erp--supports--cobros", "kind": "supports", "sourceId": "erp", "targetId": "cobros"},
    {"id": "erp--supports--contabilidad", "kind": "supports", "sourceId": "erp", "targetId": "contabilidad"},
    {"id": "erp--supports--cierre-mensual", "kind": "supports", "sourceId": "erp", "targetId": "cierre-mensual"},
    {"id": "contact-center--supports--atencion-cliente", "kind": "supports", "sourceId": "contact-center", "targetId": "atencion-cliente"},
    {"id": "contact-center--supports--devoluciones", "kind": "supports", "sourceId": "contact-center", "targetId": "devoluciones"},
    {"id": "crm--supports--devoluciones", "kind": "supports", "sourceId": "crm", "targetId": "devoluciones"},
    {"id": "alta-pedido--realizes--gestion-pedidos", "kind": "realizes", "sourceId": "alta-pedido", "targetId": "gestion-pedidos"},
    {"id": "devoluciones--realizes--atencion-cliente", "kind": "realizes", "sourceId": "devoluciones", "targetId": "atencion-cliente"},
    {"id": "cierre-mensual--realizes--contabilidad", "kind": "realizes", "sourceId": "cierre-mensual", "targetId": "contabilidad"},
    {"id": "tienda-web--runs-on--kubernetes", "kind": "runs-on", "sourceId": "tienda-web", "targetId": "kubernetes"},